[
  {
    "@context": "https://tunnelmind.ai/atap/context.jsonld",
    "@type": "WitnessEvent",
    "id": "ATAP-WE-019e30a8-5fdc-77cb-a561-60e90ae49ef9",
    "ait": "AIT-019e30a8-5a00-7d7f-be75-feea26679b36",
    "witnessed_at": "2026-05-16T12:00:01.500Z",
    "event_type": "supply:verified",
    "payload": {
      "timestamp": "2026-05-16T12:00:01.500Z",
      "supply_path": {
        "publisher_domain": "news.example",
        "exchange_domain": "exchange-a.example",
        "seller_id": "pub-12345"
      },
      "sigil_result": "pass",
      "trust_score": 0.86,
      "sigil_token": "eyJhbGciOiJFZERTQSJ9.example-payload.example-signature"
    },
    "prev_event_hash": "0x0000000000000000000000000000000000000000000000000000000000000000",
    "self_hash": "0x8038947bc4020f8ef7aa86d002cdb7abe2aa32c1faf07de9d87522a6ff05a016",
    "witness_signature": "ed25519:0x33414730e996b195d19f29cbc3070882a42d013b1805f0b674cd597f11e9cc2ce407c0d76c094ccf83dce6f17511eae652cb40bafa6cd0b996be1c98a8369d0f"
  },
  {
    "@context": "https://tunnelmind.ai/atap/context.jsonld",
    "@type": "WitnessEvent",
    "id": "ATAP-WE-019e30a8-65b8-7228-9216-9b6159f1f365",
    "ait": "AIT-019e30a8-5a00-7d7f-be75-feea26679b36",
    "witnessed_at": "2026-05-16T12:00:03.000Z",
    "event_type": "bid:submitted",
    "payload": {
      "timestamp": "2026-05-16T12:00:03.000Z",
      "exchange": "exchange-a.example",
      "publisher_domain": "news.example",
      "seller_id": "pub-12345",
      "bid_amount": 3.2,
      "currency": "USD",
      "creative_id": "cr-0001",
      "channel": "display",
      "sigil_token": "eyJhbGciOiJFZERTQSJ9.example-payload.example-signature",
      "supply_trust_score": 0.86
    },
    "prev_event_hash": "0x8038947bc4020f8ef7aa86d002cdb7abe2aa32c1faf07de9d87522a6ff05a016",
    "self_hash": "0x37614ae3c24a22178e7436f05ae7a7f113f05cd2f2d47444734954729e820f91",
    "witness_signature": "ed25519:0xeabf99bac83c3f78891dca6aac14b23ea3b86f7b775f7ace24964190cb51fa2b02f6d0a1c3f7b60c53881c60869d06fc40f08043503ec321fc79a352cc73a50c"
  },
  {
    "@context": "https://tunnelmind.ai/atap/context.jsonld",
    "@type": "WitnessEvent",
    "id": "ATAP-WE-019e30a8-6b94-70da-a623-5c94dfb5e3d5",
    "ait": "AIT-019e30a8-5a00-7d7f-be75-feea26679b36",
    "witnessed_at": "2026-05-16T12:00:04.500Z",
    "event_type": "bid:won",
    "payload": {
      "timestamp": "2026-05-16T12:00:04.500Z",
      "exchange": "exchange-a.example",
      "clearing_price": 2.8,
      "currency": "USD",
      "impression_id": "imp-77001"
    },
    "prev_event_hash": "0x37614ae3c24a22178e7436f05ae7a7f113f05cd2f2d47444734954729e820f91",
    "self_hash": "0xbca1a7e196a00a244416042c40f9b3211e49a7ff918801cd78e41a2bc41fd295",
    "witness_signature": "ed25519:0x614bce8adf741c3da0fab5d9a720671f89f29d1c67090b5a7b6c4f40bc8c3f74f167c31baf6317e59f600362316f8ed9795e569ad4921167779df4bf70ec1401"
  },
  {
    "@context": "https://tunnelmind.ai/atap/context.jsonld",
    "@type": "WitnessEvent",
    "id": "ATAP-WE-019e30a8-7170-7998-8ca8-2a961ce768d4",
    "ait": "AIT-019e30a8-5a00-7d7f-be75-feea26679b36",
    "witnessed_at": "2026-05-16T12:00:06.000Z",
    "event_type": "budget:decremented",
    "payload": {
      "timestamp": "2026-05-16T12:00:06.000Z",
      "amount": 2.8,
      "currency": "USD",
      "remaining_daily": 9997.2,
      "remaining_total": 149997.2
    },
    "prev_event_hash": "0xbca1a7e196a00a244416042c40f9b3211e49a7ff918801cd78e41a2bc41fd295",
    "self_hash": "0xbb74d871bb11326f1943756581a9467503d752dee3c5d66daabaef2db3527862",
    "witness_signature": "ed25519:0xa8f561f13326d46097968602ab67b81ed7f1fb8a5ec7b72a6cf40c6d9dca4b5a0760435316437566b0954a133c464427a0c79af179ece441c004a7a051bd4b0d"
  },
  {
    "@context": "https://tunnelmind.ai/atap/context.jsonld",
    "@type": "WitnessEvent",
    "id": "ATAP-WE-019e30a8-774c-7f05-befa-34a0f7bf543b",
    "ait": "AIT-019e30a8-5a00-7d7f-be75-feea26679b36",
    "witnessed_at": "2026-05-16T12:00:07.500Z",
    "event_type": "supply:rejected",
    "payload": {
      "timestamp": "2026-05-16T12:00:07.500Z",
      "supply_path": {
        "publisher_domain": "spoofed.example",
        "exchange_domain": "exchange-b.example",
        "seller_id": "reseller-998"
      },
      "sigil_result": "fail",
      "rejection_reason": "datacenter IP and ads.txt mismatch",
      "trust_score": 0.31
    },
    "prev_event_hash": "0xbb74d871bb11326f1943756581a9467503d752dee3c5d66daabaef2db3527862",
    "self_hash": "0xc73fd770935c647c189eca4848332ac14148818924cbfa7acd73ade536a90b1e",
    "witness_signature": "ed25519:0xe8ebe472a50fed7ff9ea563f46c76637bfb5284a07d40d8615e9f6a59189a9ebf0d30d20de29ea9568263c0c7f51450bf0732ced0121410987292bd00e40db0b"
  },
  {
    "@context": "https://tunnelmind.ai/atap/context.jsonld",
    "@type": "WitnessEvent",
    "id": "ATAP-WE-019e30a8-7d28-7653-bc7b-a5a7aa4005b9",
    "ait": "AIT-019e30a8-5a00-7d7f-be75-feea26679b36",
    "witnessed_at": "2026-05-16T12:00:09.000Z",
    "event_type": "bid:lost",
    "payload": {
      "timestamp": "2026-05-16T12:00:09.000Z",
      "exchange": "exchange-a.example",
      "reason": "outbid"
    },
    "prev_event_hash": "0xc73fd770935c647c189eca4848332ac14148818924cbfa7acd73ade536a90b1e",
    "self_hash": "0xfc1bcdaeb8730c05512186c085355ce0b2d977191c7a8cfbf7f237ea5fcc982d",
    "witness_signature": "ed25519:0x8c41c35a417944cc211ad03fbccac3e303c064f67601a58e7610f7f5bb03f8448d67522f69fc7f6b3a321cb0c66c97761c074189fd91c5cae00a5750a67d680f"
  },
  {
    "@context": "https://tunnelmind.ai/atap/context.jsonld",
    "@type": "WitnessEvent",
    "id": "ATAP-WE-019e30a8-8304-786b-ba2c-01a84eb68648",
    "ait": "AIT-019e30a8-5a00-7d7f-be75-feea26679b36",
    "witnessed_at": "2026-05-16T12:00:10.500Z",
    "event_type": "constraint:violated",
    "payload": {
      "timestamp": "2026-05-16T12:00:10.500Z",
      "constraint_name": "max_bid_cpm",
      "declared_value": 50,
      "actual_value": 62
    },
    "prev_event_hash": "0xfc1bcdaeb8730c05512186c085355ce0b2d977191c7a8cfbf7f237ea5fcc982d",
    "self_hash": "0x95f907ecf96c850f73406fe8ebef7cb9fa13dc3ae94aa680dc704ef2738297ff",
    "witness_signature": "ed25519:0xdda58d0b0834c0292999968f22050f33e6df067226dec690c01ed4d75deca3a6fc535903f974e82558567fb3c0c4a77b8b6e82d92cd625aa74db7e46e49f840f"
  }
]
