[
  {
    "@context": "https://tunnelmind.ai/atap/context.jsonld",
    "@type": "WitnessEvent",
    "id": "ATAP-WE-01a12088-d7dc-71cc-9d53-ee8615a1efed",
    "ait": "AIT-01a12088-d200-72a9-9fbc-04eb7891de5a",
    "witnessed_at": "2026-10-09T12:00:01.500Z",
    "event_type": "crew_ops:autonomy_decision",
    "payload": {
      "timestamp": "2026-10-09T12:00:01.500Z",
      "evidence": "asserted",
      "agent": "crew-toolsmith",
      "class": 2,
      "action": "propose",
      "decision": "request",
      "target_sha256": "56083e68b267977dcb5447f0a14c27a530af40632f3afdec4647a960afb6ca07"
    },
    "prev_event_hash": "0x0000000000000000000000000000000000000000000000000000000000000000",
    "self_hash": "0x17fa47453c6e35e90ed7602080c5e37aa62501a4e35f6a69e2ed9a67833ae61a",
    "witness_signature": "ed25519:0x40e94c91150a45e87973db4d05e0e08f626c88819a5bd3c9f8cf6ea02401ce93ffe83ad1cd5b219c5031cccded65f4fc01dc4673ee41baa1bc7fce73e609570b"
  },
  {
    "@context": "https://tunnelmind.ai/atap/context.jsonld",
    "@type": "WitnessEvent",
    "id": "ATAP-WE-01a12088-ddb8-7b5a-bedf-a63a0e12f246",
    "ait": "AIT-01a12088-d200-72a9-9fbc-04eb7891de5a",
    "witnessed_at": "2026-10-09T12:00:03.000Z",
    "event_type": "crew_ops:ratification",
    "payload": {
      "timestamp": "2026-10-09T12:00:03.000Z",
      "evidence": "anchored",
      "role": "owner",
      "decision": "approved",
      "channel": "mail",
      "text_sha256": "254f2cf24b3e40b32185ae29e64a0d60161b5555379730ccc6ab50d3675354b4",
      "dkim_message_id_sha256": "076288757c7ebb0ec081ff7a05fd5093f251997fec411d0d97a9e93ac2cc9d23"
    },
    "prev_event_hash": "0x17fa47453c6e35e90ed7602080c5e37aa62501a4e35f6a69e2ed9a67833ae61a",
    "self_hash": "0x8057b183a902cdfeb705303ba386e54f3fb159f68e2a8bd18b957c8943d03717",
    "witness_signature": "ed25519:0xfb9c52d0dd05951d5077bec3eeafcd97b65a3b74b69bedebdf762008422cb166304507e7a3cfee132fb4a158be27fce71f59755aa31babfc03af4c66782df903"
  },
  {
    "@context": "https://tunnelmind.ai/atap/context.jsonld",
    "@type": "WitnessEvent",
    "id": "ATAP-WE-01a12088-e394-7b6f-b6b8-50d7e24d8d23",
    "ait": "AIT-01a12088-d200-72a9-9fbc-04eb7891de5a",
    "witnessed_at": "2026-10-09T12:00:04.500Z",
    "event_type": "crew_ops:autonomy_decision",
    "payload": {
      "timestamp": "2026-10-09T12:00:04.500Z",
      "evidence": "asserted",
      "agent": "crew-toolsmith",
      "class": 2,
      "action": "propose",
      "decision": "allow",
      "target_sha256": "56083e68b267977dcb5447f0a14c27a530af40632f3afdec4647a960afb6ca07",
      "reason_sha256": "e486f82e15581cb1c71fb4774d4989d40d27e00c9bad2a139484c67073ccc9a5"
    },
    "prev_event_hash": "0x8057b183a902cdfeb705303ba386e54f3fb159f68e2a8bd18b957c8943d03717",
    "self_hash": "0x7533683fdb8961aeb59daf72bcbaa20c18ba81849ffaccc7490d7b23ec0467ea",
    "witness_signature": "ed25519:0x7ed24c071db04ce41a24f548ae8c22a0844fc4b9d3ea18882aa53cd2f1917afd28ac7858264d01faeedf9ab1567234c8fe6aaaa976c55f0c630ad25216ad8100"
  },
  {
    "@context": "https://tunnelmind.ai/atap/context.jsonld",
    "@type": "WitnessEvent",
    "id": "ATAP-WE-01a12088-e970-7945-9674-695bec5df504",
    "ait": "AIT-01a12088-d200-72a9-9fbc-04eb7891de5a",
    "witnessed_at": "2026-10-09T12:00:06.000Z",
    "event_type": "crew_ops:intake_decision",
    "payload": {
      "timestamp": "2026-10-09T12:00:06.000Z",
      "evidence": "asserted",
      "by": "toolsmith",
      "source": "thinker",
      "decision": "act",
      "title_sha256": "1b8f54bc1586b58907fd3141f436115d1ee3194df132892921a236fd54ad2c26",
      "route": "workstream"
    },
    "prev_event_hash": "0x7533683fdb8961aeb59daf72bcbaa20c18ba81849ffaccc7490d7b23ec0467ea",
    "self_hash": "0x6dfdfaad479e223f1597e2054e7f737dcca10a436566944858e0f25eeae37e9c",
    "witness_signature": "ed25519:0x1a7dd6ac40d6de1d28516cf62c855afdb46c6cfcd9ee7f50c3c98336a45d662f2c702304da84fd4f8daa9794c3a1090c314cd87cb221cf5fe2f74d2459c78003"
  }
]
