[
  {
    "@context": "https://tunnelmind.ai/atap/context.jsonld",
    "@type": "WitnessEvent",
    "id": "ATAP-WE-01a11b62-7bdc-7794-923f-2d99cb39e619",
    "ait": "AIT-01a11b62-7600-7ac5-98ac-c40f3d42d7f4",
    "witnessed_at": "2026-10-08T12:00:01.500Z",
    "event_type": "code_crew:task_claimed",
    "payload": {
      "timestamp": "2026-10-08T12:00:01.500Z",
      "evidence": "asserted",
      "task_id": "A101",
      "role": "coder",
      "model": "claude-opus-5-5"
    },
    "prev_event_hash": "0x0000000000000000000000000000000000000000000000000000000000000000",
    "self_hash": "0x15ada7bec76f3c964ef0b5cab85530e1c8eb134af967b3bf342220714ea0bdfd",
    "witness_signature": "ed25519:0xe5e6be67021390160a791af0afed7be42ffb4ecd584d5e7ef863c135e010f335297209d9b59c921a508abdaf93acebfcca5538f7e4a9dc9eea02ee1c898e430e"
  },
  {
    "@context": "https://tunnelmind.ai/atap/context.jsonld",
    "@type": "WitnessEvent",
    "id": "ATAP-WE-01a11b62-81b8-7176-abc6-27bd3e888d1f",
    "ait": "AIT-01a11b62-7600-7ac5-98ac-c40f3d42d7f4",
    "witnessed_at": "2026-10-08T12:00:03.000Z",
    "event_type": "code_crew:change_committed",
    "payload": {
      "timestamp": "2026-10-08T12:00:03.000Z",
      "evidence": "anchored",
      "repo": "example-org/example-repo",
      "commit_sha": "3f1c2a9e8b7d6c5f4a3b2c1d0e9f8a7b6c5d4e3f"
    },
    "prev_event_hash": "0x15ada7bec76f3c964ef0b5cab85530e1c8eb134af967b3bf342220714ea0bdfd",
    "self_hash": "0x298f498e666043efacb8d88361b1cb1d51182c17f9c8d4d7ae120bf073ff4339",
    "witness_signature": "ed25519:0xab385e2fdadfd76d79a14a3c9cbf4b8239dd32e0c192e91860f522d22a2e4d742415f1367dd8c5c1682fe41989a6122697b690ea0c334c39013fe2748adb8500"
  },
  {
    "@context": "https://tunnelmind.ai/atap/context.jsonld",
    "@type": "WitnessEvent",
    "id": "ATAP-WE-01a11b62-8794-7d24-b35d-56f73828aaa0",
    "ait": "AIT-01a11b62-7600-7ac5-98ac-c40f3d42d7f4",
    "witnessed_at": "2026-10-08T12:00:04.500Z",
    "event_type": "code_crew:verify_run",
    "payload": {
      "timestamp": "2026-10-08T12:00:04.500Z",
      "evidence": "witnessed",
      "command_sha256": "328e123c63857fd8473bd4bd3581e655b08b7440d7f5d2c31cc375607582f539",
      "exit_code": 0,
      "output_sha256": "2dbfad3285b2a758163a190191642ee22e4c6642be01bc65ce97e2ad06beece1"
    },
    "prev_event_hash": "0x298f498e666043efacb8d88361b1cb1d51182c17f9c8d4d7ae120bf073ff4339",
    "self_hash": "0xdae18c0eb6ba857f095920a1a9c701ad437eb54760264755fb2cf24611e5db74",
    "witness_signature": "ed25519:0x657a5ce42d2912085eef8e2e027a08098406ed09fea8fc0c21e30e77e59f67968c25a3113dcc4eba7bb7b5afe573f8a16d89db9d9c41804b946a9e5dbd6d7b08"
  },
  {
    "@context": "https://tunnelmind.ai/atap/context.jsonld",
    "@type": "WitnessEvent",
    "id": "ATAP-WE-01a11b62-8d70-72e1-8a72-56c463cbc52f",
    "ait": "AIT-01a11b62-7600-7ac5-98ac-c40f3d42d7f4",
    "witnessed_at": "2026-10-08T12:00:06.000Z",
    "event_type": "code_crew:qa_verdict",
    "payload": {
      "timestamp": "2026-10-08T12:00:06.000Z",
      "evidence": "asserted",
      "task_id": "A101",
      "verdict": "accepted",
      "attempt": 1
    },
    "prev_event_hash": "0xdae18c0eb6ba857f095920a1a9c701ad437eb54760264755fb2cf24611e5db74",
    "self_hash": "0x07c0c58514e66efaab23335bbb698fbf8b69ee22f3bc03961a035982f7dbf1be",
    "witness_signature": "ed25519:0x821ab9c125f7a8dd1838d758113b853bbc3212dd7d5001704395550b5e836ed07913db334e1aa286a63af5eeffad4db213ba81d371c20cd209cdf25524d46706"
  },
  {
    "@context": "https://tunnelmind.ai/atap/context.jsonld",
    "@type": "WitnessEvent",
    "id": "ATAP-WE-01a11b62-934c-7560-859e-abc4a4b658a3",
    "ait": "AIT-01a11b62-7600-7ac5-98ac-c40f3d42d7f4",
    "witnessed_at": "2026-10-08T12:00:07.500Z",
    "event_type": "code_crew:review_verdict",
    "payload": {
      "timestamp": "2026-10-08T12:00:07.500Z",
      "evidence": "asserted",
      "head_sha": "3f1c2a9e8b7d6c5f4a3b2c1d0e9f8a7b6c5d4e3f",
      "verdict": "pass",
      "findings": {
        "critical": 0,
        "high": 0,
        "medium": 1,
        "low": 2
      }
    },
    "prev_event_hash": "0x07c0c58514e66efaab23335bbb698fbf8b69ee22f3bc03961a035982f7dbf1be",
    "self_hash": "0x876cbca31a4a2ce058ad109aa110e0b2c97efa06fbf6d56bd7977645603875ba",
    "witness_signature": "ed25519:0x793a4f5207b0480d9702fd4977f28f0042b6fdbf37d608e23bfea8dfb1c8a0cd6cad182fd5a3371c5eeec00ce7e4846731374384743721e2fc620b1b90c2bd01"
  },
  {
    "@context": "https://tunnelmind.ai/atap/context.jsonld",
    "@type": "WitnessEvent",
    "id": "ATAP-WE-01a11b62-9928-7c67-aaea-afd279045782",
    "ait": "AIT-01a11b62-7600-7ac5-98ac-c40f3d42d7f4",
    "witnessed_at": "2026-10-08T12:00:09.000Z",
    "event_type": "code_crew:approval",
    "payload": {
      "timestamp": "2026-10-08T12:00:09.000Z",
      "evidence": "asserted",
      "role": "owner",
      "decision": "approve",
      "channel": "cli",
      "approval_text_sha256": "9cfa77f3d842a05b4ddf786d466b8b5f620c1b5649b4a93882342d7d8089ab76"
    },
    "prev_event_hash": "0x876cbca31a4a2ce058ad109aa110e0b2c97efa06fbf6d56bd7977645603875ba",
    "self_hash": "0x53d65dc686f21355e729c2d44ce0044b33806a43518d6950a51e1ed2f5ff840d",
    "witness_signature": "ed25519:0x0edefc71660e6283998fec2e2a79db3cefc74d0df69122f1b856c51c6dc9e1eacb90e6f4445fe64b52f2e67facbb2639d8f7e07eb0c39128c03c7f67fc2e9e07"
  },
  {
    "@context": "https://tunnelmind.ai/atap/context.jsonld",
    "@type": "WitnessEvent",
    "id": "ATAP-WE-01a11b62-9f04-7d56-9cff-af0865aff116",
    "ait": "AIT-01a11b62-7600-7ac5-98ac-c40f3d42d7f4",
    "witnessed_at": "2026-10-08T12:00:10.500Z",
    "event_type": "code_crew:merged",
    "payload": {
      "timestamp": "2026-10-08T12:00:10.500Z",
      "evidence": "anchored",
      "repo": "example-org/example-repo",
      "pr_number": 42,
      "merge_commit_sha": "a9b8c7d6e5f4a3b2c1d0e9f8a7b6c5d4e3f2a1b0"
    },
    "prev_event_hash": "0x53d65dc686f21355e729c2d44ce0044b33806a43518d6950a51e1ed2f5ff840d",
    "self_hash": "0x1a1f04418fb3a7781ddc7dbf25f33fe9b537758c02a1203c28139365ddbf35d4",
    "witness_signature": "ed25519:0xe3553d7ce440e855cf8f9ff852136132c4d10b938a0e97f728669f5f06048f4a0d8ea362579de44c93f5137fb1e501cc466ae15d1dd0709a78ea99066f2f0d09"
  },
  {
    "@context": "https://tunnelmind.ai/atap/context.jsonld",
    "@type": "WitnessEvent",
    "id": "ATAP-WE-01a11b62-a4e0-76c1-b6c2-352011fabf99",
    "ait": "AIT-01a11b62-7600-7ac5-98ac-c40f3d42d7f4",
    "witnessed_at": "2026-10-08T12:00:12.000Z",
    "event_type": "code_crew:deployed",
    "payload": {
      "timestamp": "2026-10-08T12:00:12.000Z",
      "evidence": "asserted",
      "target": "staging",
      "version_id": "v-0001"
    },
    "prev_event_hash": "0x1a1f04418fb3a7781ddc7dbf25f33fe9b537758c02a1203c28139365ddbf35d4",
    "self_hash": "0x9fd5bd773d1ddc116f860c5316918866e9b83afb9f250504cfb4fe4df391a0a6",
    "witness_signature": "ed25519:0x9a380718df1f56baa3a0ffcaaeed9ea2b511ee469017b30f574e1a23f75ca0865f892032f04622bfae68f80a796d541ceea9fbeef35c7b0505b56fd014c0e50a"
  }
]
