[
  {
    "@context": "https://tunnelmind.ai/atap/context.jsonld",
    "@type": "WitnessEvent",
    "id": "ATAP-WE-019e30a8-5fdc-72f8-8021-38d5bc928925",
    "ait": "AIT-019e30a8-5a00-7f71-8e23-11abca032254",
    "witnessed_at": "2026-05-16T12:00:01.500Z",
    "event_type": "supply:verified",
    "payload": {
      "timestamp": "2026-05-16T12:00:01.500Z",
      "supply_path": {
        "publisher_domain": "news.example",
        "exchange_domain": "exchange-a.example",
        "seller_id": "pub-12345"
      },
      "sigil_result": "pass",
      "trust_score": 0.86,
      "sigil_token": "eyJhbGciOiJFZERTQSJ9.example-payload.example-signature"
    },
    "prev_event_hash": "0x0000000000000000000000000000000000000000000000000000000000000000",
    "self_hash": "0x41a1a44c4cb17405b178af11c8f0348ceddff180b0ca52fdb538414d85624e08",
    "witness_signature": "ed25519:0x8fcd90ef2d5dc430e6a3429992e098ada780437a0715916084d8ee1b07c3abf696e74bd5fb9f855363231e5abd9c5d5a85d786377cbd8992f4c8d4f0a3d28d0f"
  },
  {
    "@context": "https://tunnelmind.ai/atap/context.jsonld",
    "@type": "WitnessEvent",
    "id": "ATAP-WE-019e30a8-65b8-7b52-9b4e-c1944a9e324f",
    "ait": "AIT-019e30a8-5a00-7f71-8e23-11abca032254",
    "witnessed_at": "2026-05-16T12:00:03.000Z",
    "event_type": "bid:submitted",
    "payload": {
      "timestamp": "2026-05-16T12:00:03.000Z",
      "exchange": "exchange-a.example",
      "publisher_domain": "news.example",
      "seller_id": "pub-12345",
      "bid_amount": 3.2,
      "currency": "USD",
      "creative_id": "cr-0001",
      "channel": "display",
      "sigil_token": "eyJhbGciOiJFZERTQSJ9.example-payload.example-signature",
      "supply_trust_score": 0.86
    },
    "prev_event_hash": "0x41a1a44c4cb17405b178af11c8f0348ceddff180b0ca52fdb538414d85624e08",
    "self_hash": "0xbecb9795fcb63d17bd882e8c8efcb35b84467aa1288e4320b400ca8250c0ae6d",
    "witness_signature": "ed25519:0xfc7a33feed06c4804b6d364fbf6fce0f3b67a0edda0413de28affebd267dd8a1704d2c7841321442972710d35860a9a280df7f51062e3437b839de25cb3c770d"
  },
  {
    "@context": "https://tunnelmind.ai/atap/context.jsonld",
    "@type": "WitnessEvent",
    "id": "ATAP-WE-019e30a8-6b94-791c-a083-33a20cf97f69",
    "ait": "AIT-019e30a8-5a00-7f71-8e23-11abca032254",
    "witnessed_at": "2026-05-16T12:00:04.500Z",
    "event_type": "bid:won",
    "payload": {
      "timestamp": "2026-05-16T12:00:04.500Z",
      "exchange": "exchange-a.example",
      "clearing_price": 2.8,
      "currency": "USD",
      "impression_id": "imp-77001"
    },
    "prev_event_hash": "0xbecb9795fcb63d17bd882e8c8efcb35b84467aa1288e4320b400ca8250c0ae6d",
    "self_hash": "0x1fb834eba67fedc575b1243b17c096c6440eba104119c1bda42c56d8daf37881",
    "witness_signature": "ed25519:0x5a6890cd00fe7a24a608ca010c23af20d8be498584dcaa5dc22bbda155a6e76b5f2a5695e591d8f92466898d68e63f4793bceb02696752a4252b69091f6a1a01"
  },
  {
    "@context": "https://tunnelmind.ai/atap/context.jsonld",
    "@type": "WitnessEvent",
    "id": "ATAP-WE-019e30a8-7170-7e4e-aa2a-4d5ce4d60a95",
    "ait": "AIT-019e30a8-5a00-7f71-8e23-11abca032254",
    "witnessed_at": "2026-05-16T12:00:06.000Z",
    "event_type": "budget:decremented",
    "payload": {
      "timestamp": "2026-05-16T12:00:06.000Z",
      "amount": 2.8,
      "currency": "USD",
      "remaining_daily": 9997.2,
      "remaining_total": 149997.2
    },
    "prev_event_hash": "0x1fb834eba67fedc575b1243b17c096c6440eba104119c1bda42c56d8daf37881",
    "self_hash": "0xb442a5cae3d5e93c503854113892b55dfcbd2c9c16f0cbd009b1f19d3857d0e9",
    "witness_signature": "ed25519:0xaa0937d071f946f27124770faa8b85cc4603849365474071e496582d89b435686af3bf6b5590886195d3963ffa64eb7976a99d3bb52b890196ff3e9e76159707"
  },
  {
    "@context": "https://tunnelmind.ai/atap/context.jsonld",
    "@type": "WitnessEvent",
    "id": "ATAP-WE-019e30a8-774c-78f1-aeb0-f54ee0453512",
    "ait": "AIT-019e30a8-5a00-7f71-8e23-11abca032254",
    "witnessed_at": "2026-05-16T12:00:07.500Z",
    "event_type": "supply:rejected",
    "payload": {
      "timestamp": "2026-05-16T12:00:07.500Z",
      "supply_path": {
        "publisher_domain": "spoofed.example",
        "exchange_domain": "exchange-b.example",
        "seller_id": "reseller-998"
      },
      "sigil_result": "fail",
      "rejection_reason": "datacenter IP and ads.txt mismatch",
      "trust_score": 0.31
    },
    "prev_event_hash": "0xb442a5cae3d5e93c503854113892b55dfcbd2c9c16f0cbd009b1f19d3857d0e9",
    "self_hash": "0x9fad160d8b3aa7e35b463b40aaa44650abf6d7967e5dab9e50ef93463773afad",
    "witness_signature": "ed25519:0xe194d5fd06ab07381f8a89ba7068160ae64740f7b28e81ff202d563a0ca58cc1f2c6b45a66cad6e9faf8907f30582c3fe5e23f6aecd30f9038f65b479aa52c0b"
  },
  {
    "@context": "https://tunnelmind.ai/atap/context.jsonld",
    "@type": "WitnessEvent",
    "id": "ATAP-WE-019e30a8-7d28-7bb9-bc09-ce165a418c13",
    "ait": "AIT-019e30a8-5a00-7f71-8e23-11abca032254",
    "witnessed_at": "2026-05-16T12:00:09.000Z",
    "event_type": "bid:lost",
    "payload": {
      "timestamp": "2026-05-16T12:00:09.000Z",
      "exchange": "exchange-a.example",
      "reason": "outbid"
    },
    "prev_event_hash": "0x9fad160d8b3aa7e35b463b40aaa44650abf6d7967e5dab9e50ef93463773afad",
    "self_hash": "0x4832ec919f4a5358624a2536a2cb195761c9c5f3825f41b3b7c72900ab6ffcf4",
    "witness_signature": "ed25519:0x19a84b5bcbff3910b86e2386ca9279cdda9ca997d00e488d90c81cb11ddda527497ac5e33b1bf5de1da3adadaa2f229802ee63ab98afd72055f88015ff1c6e0c"
  },
  {
    "@context": "https://tunnelmind.ai/atap/context.jsonld",
    "@type": "WitnessEvent",
    "id": "ATAP-WE-019e30a8-8304-7115-947d-a0453ef05146",
    "ait": "AIT-019e30a8-5a00-7f71-8e23-11abca032254",
    "witnessed_at": "2026-05-16T12:00:10.500Z",
    "event_type": "constraint:violated",
    "payload": {
      "timestamp": "2026-05-16T12:00:10.500Z",
      "constraint_name": "max_bid_cpm",
      "declared_value": 50,
      "actual_value": 62
    },
    "prev_event_hash": "0x4832ec919f4a5358624a2536a2cb195761c9c5f3825f41b3b7c72900ab6ffcf4",
    "self_hash": "0xd2146d89a7f7abbfb659f4b8652d069083c7d33b887ad5c0cca404aedfe0c3bd",
    "witness_signature": "ed25519:0xf537b7ec9b65abbd9f35dba22f9ea7bbce8d9da2113a4c972a1e99746b2a9725c3edf18ab5eed291baf36da0c7174b1546055841913573a3d7a534d3b2421d01"
  }
]
